seller_id,nama_penjual,menu
882,es_dawet Bu Y G,es_dawet
883,es_oyen Pak Q D,es_oyen
884,nasi_goreng Bu H B,nasi_goreng
885,es_dawet Bu L A,es_dawet
886,es_oyen Pak H P,es_oyen
887,tahu_tek Bu C I,tahu_tek
888,sate Bu D W,sate
889,nasi_goreng Bu S J,nasi_goreng
890,pentol Pak I H,pentol
891,sate Bu X P,sate
892,seblak Bu L E,seblak
893,rujak Pak I Z,rujak
894,siomay Bu Q T,siomay
895,soto Bu R V,soto
896,rujak Bu H V,rujak
897,seblak Pak P Y,seblak
898,tahu_tek Bu R R,tahu_tek
899,batagor Pak G A,batagor
900,es_campur Pak N Q,es_campur
901,rujak Pak F F,rujak
902,es_dawet Bu J Q,es_dawet
903,es_dawet Pak D P,es_dawet
904,es_dawet Pak E H,es_dawet
905,sate Bu W G,sate
906,soto Pak J M,soto
907,mie_ayam Pak C H,mie_ayam
908,mie_ayam Bu V B,mie_ayam
909,nasi_goreng Bu G V,nasi_goreng
910,es_campur Pak D M,es_campur
911,soto Bu P F,soto
912,soto Bu B C,es_dawet | soto
913,soto Bu A T,soto
914,nasi_goreng Pak H P,nasi_goreng | seblak
915,es_dawet Bu Y G,es_dawet
916,es_dawet Bu K B,es_dawet
917,seblak Pak S F,seblak
918,tahu_tek Pak L I,tahu_tek
919,tahu_tek Pak B Y,tahu_tek
920,rujak Pak M O,rujak
921,es_campur Pak C I,es_campur
922,mie_ayam Pak B A,mie_ayam | siomay
923,batagor Pak U I,tahu_tek | batagor
924,mie_ayam Bu F Z,mie_ayam
925,rujak Bu C P,rujak
926,kacang_hijau Bu Q P,kacang_hijau
927,es_campur Pak V O,es_campur
928,rujak Pak L A,rujak
929,kacang_hijau Pak C D,kacang_hijau
930,siomay Bu D A,siomay
931,mie_ayam Bu B Q,mie_ayam
932,pentol Pak D O,pentol
933,soto Pak D V,soto
934,pentol Bu V B,pentol | soto
935,sate Bu Z T,sate
936,es_campur Pak G G,es_campur
937,rujak Pak G U,rujak
938,seblak Bu X M,seblak
939,es_dawet Pak F I,es_dawet
940,siomay Bu J V,siomay
941,es_dawet Bu N V,es_dawet
942,sate Bu V H,sate
943,es_campur Bu R M,es_campur
944,siomay Pak K F,siomay
945,seblak Bu O Y,batagor | seblak
946,pentol Bu A M,pentol
947,mie_ayam Bu Y L,mie_ayam
948,sate Bu R J,sate
949,rujak Bu U D,soto | rujak
950,sate Pak W P,sate
951,seblak Bu H K,seblak
952,sate Pak P P,sate
953,rujak Bu M Y,rujak
954,siomay Bu Q N,siomay
955,soto Bu E E,soto
956,pentol Pak D G,pentol
957,tahu_tek Pak T M,tahu_tek
958,mie_ayam Bu J A,mie_ayam | es_dawet
959,tahu_tek Bu Q J,tahu_tek
960,tahu_tek Bu O K,tahu_tek | soto
961,tahu_tek Bu T E,tahu_tek | kacang_hijau
962,rujak Pak Z H,es_dawet | rujak
963,rujak Pak R W,rujak
964,batagor Pak K E,batagor | es_campur
965,seblak Bu Y W,seblak
966,soto Pak O B,soto
967,es_dawet Bu A S,es_dawet
968,rujak Bu Z O,rujak
969,soto Bu X H,soto
970,kacang_hijau Bu W X,pentol | kacang_hijau
971,pentol Bu G K,pentol | es_oyen
972,rujak Bu J T,seblak | rujak
973,rujak Pak P A,rujak
974,sate Bu G B,sate
975,mie_ayam Pak X Z,mie_ayam
976,seblak Pak D O,seblak
977,siomay Pak X K,siomay
978,rujak Bu A P,rujak
979,nasi_goreng Bu V U,nasi_goreng
980,rujak Pak K H,rujak
981,es_oyen Pak Z F,es_oyen | es_campur
982,tahu_tek Pak K E,tahu_tek
983,pentol Bu Q P,pentol
984,es_campur Pak X W,es_campur
985,rujak Bu Y T,rujak
986,sate Bu U N,sate
987,siomay Pak X Z,siomay
988,soto Pak W P,soto
989,pentol Pak S H,pentol
990,es_dawet Bu J V,es_dawet
991,nasi_goreng Pak K P,nasi_goreng
992,tahu_tek Pak Y R,tahu_tek
993,batagor Pak G E,batagor
994,nasi_goreng Pak M S,nasi_goreng | es_oyen
995,sate Bu Z L,sate
996,tahu_tek Bu Q B,tahu_tek
997,nasi_goreng Pak M Y,nasi_goreng
998,es_oyen Pak D W,es_oyen
999,sate Bu S Y,sate
1000,mie_ayam Bu Y B,mie_ayam
